{
  "dataset": {
    "version": "0.3-r-05-research-return",
    "prepared_on": "2026-10-02",
    "publication_status": "internal_working",
    "scope": {
      "state": "Ohio",
      "pilot_counties": [
        "Morrow",
        "Knox",
        "Marion",
        "Delaware"
      ],
      "intended_population": "Veterans, surviving spouses, caregivers, and people of any age with disabilities; each program has its own scope."
    },
    "derived_from": [
      {
        "name": "data/schema/schema_v0.3.json",
        "sha256": "32c8eb01086daf2a8acd587e1b2442fa4725d453472ccb9dbeaf6294be1ca214"
      },
      {
        "name": "research/tasks/R-05-general-resource-link-layer.md",
        "sha256": "7693c7602656ee4a3ddbabd060886ba3372c1fd07f813785546a3bc53a48893f"
      },
      {
        "name": "data/batches/B01/b01_resources.json",
        "batch_id": "OH-SDR-S1-B01",
        "sha256": "e9dbca19d24d4dc1a3249098545738721da5aaeb1031ba3dd14d025c944602e9"
      }
    ]
  },
  "organizations": [
    {
      "organization_id": "r05-district5",
      "name": "Ohio District 5 Area Agency on Aging",
      "org_type": "area_agency_on_aging",
      "official_url": "https://www.aaa5ohio.org/",
      "service_area": [
        "Morrow",
        "Knox",
        "Marion"
      ],
      "internal_contact": null,
      "verification": {
        "record_status": "official_source_reviewed",
        "identity": "official_source_reviewed",
        "contact": "official_source_reviewed",
        "eligibility": "official_source_reviewed",
        "last_reviewed_on": "2026-10-02"
      },
      "relationship_to_vhg": "external_resource_not_confirmed_partner"
    },
    {
      "organization_id": "r05-coaaa",
      "name": "Central Ohio Area Agency on Aging",
      "org_type": "area_agency_on_aging",
      "official_url": "https://www.coaaa.org/",
      "service_area": [
        "Delaware"
      ],
      "internal_contact": null,
      "verification": {
        "record_status": "official_source_reviewed",
        "identity": "official_source_reviewed",
        "contact": "official_source_reviewed",
        "eligibility": "official_source_reviewed",
        "last_reviewed_on": "2026-10-02"
      },
      "relationship_to_vhg": "external_resource_not_confirmed_partner"
    },
    {
      "organization_id": "r05-helpline",
      "name": "HelpLine",
      "org_type": "nonprofit",
      "official_url": "https://helplinedelmor.org/",
      "service_area": [
        "Morrow",
        "Delaware"
      ],
      "internal_contact": null,
      "verification": {
        "record_status": "official_source_reviewed",
        "identity": "official_source_reviewed",
        "contact": "official_source_reviewed",
        "eligibility": "official_source_reviewed",
        "last_reviewed_on": "2026-10-02"
      },
      "relationship_to_vhg": "external_resource_not_confirmed_partner"
    },
    {
      "organization_id": "r05-pathways",
      "name": "Pathways of Central Ohio",
      "org_type": "nonprofit",
      "official_url": "https://pathwaysofcentralohio.com/",
      "service_area": [
        "Knox",
        "Marion"
      ],
      "internal_contact": null,
      "verification": {
        "record_status": "official_source_reviewed",
        "identity": "official_source_reviewed",
        "contact": "official_source_reviewed",
        "eligibility": "official_source_reviewed",
        "last_reviewed_on": "2026-10-02"
      },
      "relationship_to_vhg": "external_resource_not_confirmed_partner"
    },
    {
      "organization_id": "r05-morrow-dd",
      "name": "Morrow County Board of Developmental Disabilities",
      "org_type": "county_board_dd",
      "official_url": "https://www.morrowdd.com/",
      "service_area": [
        "Morrow"
      ],
      "internal_contact": null,
      "verification": {
        "record_status": "official_source_reviewed",
        "identity": "official_source_reviewed",
        "contact": "official_source_reviewed",
        "eligibility": "official_source_reviewed",
        "last_reviewed_on": "2026-10-02"
      },
      "relationship_to_vhg": "external_resource_not_confirmed_partner"
    },
    {
      "organization_id": "r05-knox-dd",
      "name": "Knox County Board of Developmental Disabilities",
      "org_type": "county_board_dd",
      "official_url": "https://www.knoxdd.com/",
      "service_area": [
        "Knox"
      ],
      "internal_contact": null,
      "verification": {
        "record_status": "official_source_reviewed",
        "identity": "official_source_reviewed",
        "contact": "official_source_reviewed",
        "eligibility": "official_source_reviewed",
        "last_reviewed_on": "2026-10-02"
      },
      "relationship_to_vhg": "external_resource_not_confirmed_partner"
    },
    {
      "organization_id": "r05-marion-dd",
      "name": "Marion County Board of Developmental Disabilities",
      "org_type": "county_board_dd",
      "official_url": "https://www.marioncountydd.org/",
      "service_area": [
        "Marion"
      ],
      "internal_contact": null,
      "verification": {
        "record_status": "official_source_reviewed",
        "identity": "official_source_reviewed",
        "contact": "official_source_reviewed",
        "eligibility": "official_source_reviewed",
        "last_reviewed_on": "2026-10-02"
      },
      "relationship_to_vhg": "external_resource_not_confirmed_partner"
    },
    {
      "organization_id": "r05-delaware-dd",
      "name": "Delaware County Board of Developmental Disabilities",
      "org_type": "county_board_dd",
      "official_url": "https://www.dcbdd.org/",
      "service_area": [
        "Delaware"
      ],
      "internal_contact": null,
      "verification": {
        "record_status": "official_source_reviewed",
        "identity": "official_source_reviewed",
        "contact": "official_source_reviewed",
        "eligibility": "official_source_reviewed",
        "last_reviewed_on": "2026-10-02"
      },
      "relationship_to_vhg": "external_resource_not_confirmed_partner"
    },
    {
      "organization_id": "r05-morrow-jfs",
      "name": "Morrow County Job and Family Services",
      "org_type": "other",
      "official_url": "https://jfs.morrowcountyohio.gov/",
      "service_area": [
        "Morrow"
      ],
      "internal_contact": null,
      "verification": {
        "record_status": "official_source_reviewed",
        "identity": "official_source_reviewed",
        "contact": "official_source_reviewed",
        "eligibility": "official_source_reviewed",
        "last_reviewed_on": "2026-10-02"
      },
      "relationship_to_vhg": "external_resource_not_confirmed_partner"
    },
    {
      "organization_id": "r05-knox-jfs",
      "name": "Knox County Job and Family Services",
      "org_type": "other",
      "official_url": "https://co.knox.oh.us/jfs/",
      "service_area": [
        "Knox"
      ],
      "internal_contact": null,
      "verification": {
        "record_status": "official_source_reviewed",
        "identity": "official_source_reviewed",
        "contact": "official_source_reviewed",
        "eligibility": "official_source_reviewed",
        "last_reviewed_on": "2026-10-02"
      },
      "relationship_to_vhg": "external_resource_not_confirmed_partner"
    },
    {
      "organization_id": "r05-marion-jfs",
      "name": "Marion County Job and Family Services",
      "org_type": "other",
      "official_url": "https://mcjfs.com/",
      "service_area": [
        "Marion"
      ],
      "internal_contact": null,
      "verification": {
        "record_status": "official_source_reviewed",
        "identity": "official_source_reviewed",
        "contact": "official_source_reviewed",
        "eligibility": "official_source_reviewed",
        "last_reviewed_on": "2026-10-02"
      },
      "relationship_to_vhg": "external_resource_not_confirmed_partner"
    },
    {
      "organization_id": "r05-delaware-jfs",
      "name": "Delaware County Job and Family Services",
      "org_type": "other",
      "official_url": "https://jfs.co.delaware.oh.us/",
      "service_area": [
        "Delaware"
      ],
      "internal_contact": null,
      "verification": {
        "record_status": "official_search_extract_only",
        "identity": "official_search_extract_only",
        "contact": "official_search_extract_only",
        "eligibility": "official_search_extract_only",
        "last_reviewed_on": "2026-10-02"
      },
      "relationship_to_vhg": "external_resource_not_confirmed_partner"
    },
    {
      "organization_id": "r05-easterseals",
      "name": "Easterseals Central and Southeast Ohio",
      "org_type": "nonprofit",
      "official_url": "https://www.coaaa.org/resources/emergency-and-crisis/adult-protective-services-consumer-protection/",
      "service_area": [
        "Delaware"
      ],
      "internal_contact": null,
      "verification": {
        "record_status": "official_source_reviewed",
        "identity": "official_source_reviewed",
        "contact": "official_source_reviewed",
        "eligibility": "official_source_reviewed",
        "last_reviewed_on": "2026-10-02"
      },
      "relationship_to_vhg": "external_resource_not_confirmed_partner"
    },
    {
      "organization_id": "r05-aging",
      "name": "Ohio Department of Aging",
      "org_type": "state_agency",
      "official_url": "https://aging.ohio.gov/",
      "service_area": [
        "statewide"
      ],
      "internal_contact": null,
      "verification": {
        "record_status": "official_source_reviewed",
        "identity": "official_source_reviewed",
        "contact": "official_source_reviewed",
        "eligibility": "official_source_reviewed",
        "last_reviewed_on": "2026-10-02"
      },
      "relationship_to_vhg": "external_resource_not_confirmed_partner"
    },
    {
      "organization_id": "r05-cms",
      "name": "Centers for Medicare & Medicaid Services",
      "org_type": "federal_agency",